{
  "kit_version": "0.1",
  "brand_id": "whisk",
  "tenant_id": "framio",
  "name": "Whisk",
  "status": "draft",
  "label": "concept_study",
  "pilot": true,
  "sector": "Matcha odaklı kafe; matcha ve ekipman e-ticareti, toptan satış",
  "location": "Ankaralılar Cd. No:21 D:30, Çayyolu, Ankara (Instagram profili, 2026-10-23)",
  "links": [
    {
      "kind": "website",
      "url": "https://whiskandmore.com/",
      "verified": true
    },
    {
      "kind": "instagram",
      "url": "https://www.instagram.com/whisk.more",
      "verified": true
    }
  ],
  "colors": {
    "ink": {
      "hex": "#000000",
      "role": "ink",
      "source": "web sitesi CSS (gövde metni), 2026-10-23"
    },
    "paper": {
      "hex": "#FFFFFF",
      "role": "paper",
      "source": "web sitesi CSS, 2026-10-23"
    },
    "sky": {
      "hex": "#84ABD5",
      "role": "primary",
      "source": "web sitesi CSS, 2026-10-23; logo wordmark rengiyle aynı, marka rengi olarak kabul edildi; Instagram gönderilerinde doğrulandı (2026-10-23)"
    },
    "cocoa": {
      "hex": "#5B3828",
      "role": "secondary",
      "source": "web sitesi CSS, 2026-10-23; Instagram gönderilerinde doğrulandı (2026-10-23)"
    },
    "cream": {
      "hex": "#FFF1E2",
      "role": "other",
      "source": "web sitesi CSS (açık zemin), 2026-10-23"
    },
    "butter": {
      "hex": "#FAF6BC",
      "role": "accent",
      "source": "web sitesi CSS ('Keşfet' düğmesi), 2026-10-23; Instagram gönderilerinde doğrulandı (2026-10-23)"
    },
    "muted": {
      "hex": "#545454",
      "role": "muted",
      "source": "web sitesi CSS (ikincil metin), 2026-10-23"
    },
    "ink_inverse": {
      "hex": "#FFFFFF",
      "role": "ink_inverse",
      "source": "türetilmiş: paper ile aynı beyaz, koyu zemin üstü metin için"
    }
  },
  "fonts": {
    "display": {
      "family": "League Spartan",
      "files": [
        "assets/LeagueSpartan[wght].ttf"
      ],
      "asset_id": "font/spartan",
      "weights": [
        100,
        200,
        300,
        400,
        500,
        600,
        700,
        800,
        900
      ]
    },
    "text": {
      "family": "League Spartan",
      "files": [
        "assets/LeagueSpartan[wght].ttf"
      ],
      "asset_id": "font/spartan",
      "weights": [
        100,
        200,
        300,
        400,
        500,
        600,
        700,
        800,
        900
      ]
    }
  },
  "logos": [
    {
      "id": "logo_primary",
      "variant": "primary",
      "file": "assets/logo.png",
      "asset_id": "logo/whisk_primary"
    }
  ],
  "tone": {
    "voice": "Kısa, esprili, samimi; satış dili yok. Ağırlıkla İngilizce, \"whisk\" kelime oyunları. Slogan: Whisk up the day.",
    "address": "sen",
    "do": [
      "Tek satırlık başlık + 1-2 emoji + 4-5 hashtag",
      "Gerçek an ve tek ürün odaklı görsel",
      "Grafik gönderilerde tek mesaj, geniş boşluk, büyük harf daktilo tipi",
      "Logoyu ambalaj ve bardak gibi kalıcı öğelerde taşı"
    ],
    "dont": [
      "Her görsele logo bandı veya iletişim şeridi ekleme",
      "Kalabalık, çok öğeli kompozisyon",
      "Agresif kampanya dili"
    ],
    "sample": "Slow mornings, fast whisks. 🩵"
  },
  "provenance": {
    "assets": [
      {
        "id": "font/spartan",
        "source": "https://github.com/google/fonts/tree/main/ofl/leaguespartan (Google Fonts resmi deposu; upstream theleagueof/league-spartan). Sitede CSS adı: Spartan",
        "license": "SIL OFL 1.1",
        "retrieved": "2026-10-23",
        "notes": "Değişken font (wght). Lisans metni: assets/OFL-LeagueSpartan.txt. Türkçe glif denetimini geçti. Sitedeki Spartan ile aynı aile olduğu varsayıldı (Spartan, League Spartan olarak yeniden adlandırıldı)."
      },
      {
        "id": "logo/whisk_primary",
        "source": "https://cdn.myikas.com/images/theme-images/c1482a17-185c-4569-aafb-cc63b309d9b3/image_1080.webp",
        "license": "Marka sahibine ait; izinsiz, yalnızca iç konsept çalışması",
        "retrieved": "2026-10-23",
        "notes": "1080 px WebP, saydam zemin, el yazısı wordmark. Rengi #84ABD5 ile uyumlu. Renderer WebP okuyamadığı için Windows WIC ile PNG formatına çevrildi (assets/logo.png); kaynak dosya assets/logo.webp."
      }
    ]
  },
  "open_questions": [
    "Grafik gönderilerdeki daktilo/monospace yazı tipinin adı ve lisansı nedir?",
    "Konsept metinleri İngilizce mi, Türkçe mi, ikisi birden mi?",
    "Gerçek ürün fotoğrafı yok; fotoğraf gerektiren konseptler yer tutucuyla mı kalsın?"
  ],
  "notes": "Pilot B olarak seçildi (kullanıcı, 2026-10-23). Gerçek ve izinsiz bir işletme: çıktılar konsept çalışmasıdır, yayınlanmaz. Instagram stil kartı: docs/style-cards/whisk.md (2026-10-23)."
}
